{
  "schemaVersion": "1.0.0",
  "datasetVersion": "1.0.0",
  "maintainer": {
    "name": "xLagerFeuer",
    "email": "alexander.zhdanoff@gmail.com"
  },
  "answers": {
    "1766161329323": {
      "taskName": "Visual adding",
      "testOutputs": [
        {
          "exampleIndex": 0,
          "output": [
            [
              1,
              2,
              3
            ],
            [
              2,
              1,
              3
            ],
            [
              1,
              1,
              2
            ]
          ]
        }
      ]
    },
    "1766161453874": {
      "taskName": "Visual padding shift",
      "testOutputs": [
        {
          "exampleIndex": 0,
          "output": [
            [
              3,
              4,
              5,
              6,
              2
            ]
          ]
        }
      ]
    },
    "1766161734730": {
      "taskName": "Triangle, choose side",
      "testOutputs": [
        {
          "exampleIndex": 0,
          "output": [
            [
              1,
              1,
              1,
              1,
              1,
              1,
              1,
              1,
              1,
              2
            ],
            [
              1,
              0,
              0,
              0,
              0,
              0,
              0,
              0,
              2,
              0
            ],
            [
              1,
              0,
              0,
              0,
              0,
              0,
              0,
              2,
              0,
              0
            ],
            [
              1,
              0,
              0,
              0,
              0,
              0,
              2,
              0,
              0,
              0
            ],
            [
              1,
              0,
              0,
              0,
              0,
              2,
              0,
              0,
              0,
              0
            ],
            [
              1,
              0,
              0,
              0,
              2,
              0,
              0,
              0,
              0,
              0
            ],
            [
              1,
              0,
              0,
              2,
              0,
              0,
              0,
              0,
              0,
              0
            ],
            [
              1,
              0,
              2,
              0,
              0,
              0,
              0,
              0,
              0,
              0
            ],
            [
              1,
              2,
              0,
              0,
              0,
              0,
              0,
              0,
              0,
              0
            ],
            [
              2,
              0,
              0,
              0,
              0,
              0,
              0,
              0,
              0,
              0
            ]
          ]
        }
      ]
    },
    "1766162014465": {
      "taskName": "Snake",
      "testOutputs": [
        {
          "exampleIndex": 0,
          "output": [
            [
              0,
              0,
              0,
              0,
              0,
              0,
              0,
              0,
              0,
              0
            ],
            [
              0,
              0,
              0,
              0,
              0,
              0,
              0,
              0,
              0,
              0
            ],
            [
              0,
              0,
              0,
              0,
              0,
              0,
              0,
              0,
              0,
              0
            ],
            [
              0,
              0,
              1,
              1,
              1,
              0,
              0,
              0,
              0,
              0
            ],
            [
              0,
              0,
              0,
              0,
              1,
              1,
              0,
              0,
              0,
              0
            ],
            [
              0,
              0,
              0,
              0,
              0,
              1,
              1,
              3,
              0,
              0
            ],
            [
              0,
              0,
              0,
              0,
              0,
              0,
              0,
              0,
              0,
              0
            ],
            [
              0,
              0,
              0,
              0,
              0,
              0,
              0,
              0,
              0,
              0
            ],
            [
              0,
              0,
              0,
              0,
              0,
              0,
              0,
              0,
              0,
              0
            ],
            [
              0,
              0,
              0,
              0,
              0,
              0,
              0,
              0,
              0,
              0
            ]
          ]
        }
      ]
    },
    "1766162198404": {
      "taskName": "Circle round",
      "testOutputs": [
        {
          "exampleIndex": 0,
          "output": [
            [
              0,
              0,
              4,
              0,
              4,
              0,
              0
            ],
            [
              0,
              4,
              3,
              3,
              3,
              4,
              0
            ],
            [
              4,
              3,
              0,
              0,
              0,
              3,
              4
            ],
            [
              4,
              3,
              2,
              0,
              2,
              3,
              4
            ],
            [
              4,
              3,
              0,
              2,
              0,
              3,
              4
            ],
            [
              0,
              4,
              3,
              0,
              3,
              4,
              0
            ],
            [
              0,
              0,
              4,
              4,
              4,
              0,
              0
            ]
          ]
        }
      ]
    },
    "1766162609716": {
      "taskName": "Y map figure",
      "testOutputs": [
        {
          "exampleIndex": 0,
          "output": [
            [
              0,
              2,
              2,
              2,
              0
            ],
            [
              0,
              2,
              0,
              0,
              0
            ],
            [
              0,
              2,
              2,
              2,
              0
            ],
            [
              0,
              0,
              0,
              2,
              0
            ],
            [
              0,
              2,
              2,
              2,
              0
            ]
          ]
        }
      ]
    },
    "1766164328702": {
      "taskName": "Simmetry Mozaic",
      "testOutputs": [
        {
          "exampleIndex": 0,
          "output": [
            [
              0,
              0,
              0,
              5,
              0,
              4,
              0,
              5,
              0,
              0
            ],
            [
              2,
              2,
              2,
              5,
              2,
              4,
              1,
              5,
              1,
              1
            ],
            [
              1,
              1,
              1,
              5,
              1,
              4,
              2,
              5,
              2,
              2
            ],
            [
              0,
              0,
              0,
              5,
              0,
              4,
              0,
              5,
              0,
              0
            ],
            [
              5,
              5,
              5,
              5,
              5,
              5,
              5,
              5,
              5,
              5
            ],
            [
              0,
              0,
              0,
              5,
              0,
              4,
              0,
              5,
              0,
              0
            ],
            [
              1,
              1,
              1,
              5,
              1,
              4,
              2,
              5,
              2,
              2
            ],
            [
              2,
              2,
              2,
              5,
              2,
              4,
              1,
              5,
              1,
              1
            ],
            [
              0,
              0,
              0,
              5,
              0,
              4,
              0,
              5,
              0,
              0
            ]
          ]
        }
      ]
    },
    "1766164789008": {
      "taskName": "Predict Block drop",
      "testOutputs": [
        {
          "exampleIndex": 0,
          "output": [
            [
              5,
              6,
              6,
              0,
              0,
              0,
              0,
              0
            ],
            [
              5,
              0,
              0,
              0,
              0,
              0,
              0,
              0
            ],
            [
              5,
              0,
              0,
              0,
              0,
              0,
              0,
              0
            ],
            [
              5,
              0,
              0,
              0,
              0,
              0,
              0,
              0
            ],
            [
              5,
              4,
              0,
              0,